{
  "contract_name": "canon_proposal",
  "contract_version": 2,
  "draft": {
    "draft_id": "draft_editor",
    "authority": "draft",
    "source_set_digest": "aaaaaaaaaaaaaaaaaaaaaaaaaaaaaaaaaaaaaaaaaaaaaaaaaaaaaaaaaaaaaaaa",
    "content_digest": "bbbbbbbbbbbbbbbbbbbbbbbbbbbbbbbbbbbbbbbbbbbbbbbbbbbbbbbbbbbbbbbb"
  },
  "proposal": {
    "proposal_id": "proposal_editor",
    "proposal_version": 1,
    "status": "needs_review",
    "campaign_id": "campaign_alpha",
    "base_revision": "revision_12",
    "source_revision": "revision_12",
    "expected_campaign_head": "revision_12",
    "expected_editor_workflow_version": 7,
    "diff_digest": "cccccccccccccccccccccccccccccccccccccccccccccccccccccccccccccccc",
    "authority_change_ids": [],
    "visibility_change_ids": ["change_station"],
    "changes": [
      {
        "change_id": "change_station",
        "subject_id": "record-station",
        "change_type": "update",
        "from_authority": "preparation",
        "to_authority": "preparation",
        "before": {
          "record_type": "location",
          "displayed_name": "Synthetic Station",
          "visibility": {"audience": "warden", "warden_only": true},
          "content_digest": "dddddddddddddddddddddddddddddddddddddddddddddddddddddddddddddddd",
          "connections": [
            {
              "connection_id": "connection_company",
              "target_record_id": "record-company",
              "relationship": "works-for",
              "state": "current",
              "context": "The station handles salvage contracts."
            }
          ]
        },
        "after": {
          "record_type": "location",
          "displayed_name": "Synthetic Station",
          "visibility": {"audience": "shared", "warden_only": false},
          "content_digest": "ffffffffffffffffffffffffffffffffffffffffffffffffffffffffffffffff",
          "connections": [
            {
              "connection_id": "connection_company",
              "target_record_id": "record-company",
              "relationship": "works-for",
              "state": "current",
              "context": "The station handles salvage contracts."
            }
          ]
        }
      }
    ]
  },
  "validation": {
    "status": "passed",
    "validation_digest": "eeeeeeeeeeeeeeeeeeeeeeeeeeeeeeeeeeeeeeeeeeeeeeeeeeeeeeeeeeeeeeee",
    "error_count": 0
  },
  "approval_binding": null
}
